{
  "environment": {
    "number_of_hosts": 1,
    "schedule_type": "",
    "preemptible": true,
    "num_of_cores": 1,
    "microtick_values": 1
  },
  "system": {
    "tt_utilization": 2.2,
    "et_utilization": 2.2,
    "num_of_tt_tasks": 1,
    "num_of_et_tasks": 1,
    "periods":
            [[100, 2.0],
            [100, 3.0]]
  },
  "task": {
    "allowed_jitter": 2.2,
    "release_time": 2.2,
    "deadline_type": ""
  },
  "chain": {
    "num_of_chains": 1,
    "num_of_tasks_in_chain": 1,
    "num_of_low": 1,
    "num_of_high": 1,
    "num_of_host_transitions": 1,
    "latency": 2.2
  }
}